cluster,requirement_id,type,description,based_on_comments
0,FR001,FUNCTIONAL,The system shall handle emoji input in chat without crashing.,7
0,FR002,FUNCTIONAL,The system shall allow users to view photos without requiring app restarts.,"8, 75, 81"
0,FR003,FUNCTIONAL,The system shall correctly update the timeline without requiring manual app restarts.,"63, 67, 101"
0,FR004,FUNCTIONAL,The system shall prevent unintended phone shutdowns triggered by app interactions.,"5, 65, 70"
0,FR005,FUNCTIONAL,The system shall ensure background tasks do not degrade overall phone performance.,"18, 82"
0,FR006,FUNCTIONAL,The system shall retain typed text during app freezes or crashes.,"33, 87"
0,FR007,FUNCTIONAL,The system shall properly handle GPS functionality without persistent locks.,25
0,FR008,FUNCTIONAL,The system shall restore the notification bar and keyboard after app freezes.,78
0,NFR001,NON_FUNCTIONAL,The system shall maintain a crash rate of <0.1% per user session.,"1, 3, 6, 9, 13, 15, 19, 20, 44, 46, 48, 60, 61, 64, 66, 71, 74, 80, 84, 85, 96, 98"
0,NFR002,NON_FUNCTIONAL,"The system shall respond to user interactions (e.g., clicks, scrolls) within 1 second.","11, 30, 35, 41, 72, 102"
0,NFR003,NON_FUNCTIONAL,The system shall prevent freezing during normal use (defined as <1 freeze per 100 user actions).,"2, 10, 16, 17, 22, 23, 24, 26, 32, 34, 38, 39, 42, 45, 49, 50, 52, 55, 56, 68, 69, 73, 77, 79, 81, 86, 89, 90, 92, 93, 95, 97, 99, 100, 103, 104, 105"
0,NFR004,NON_FUNCTIONAL,The system shall load all pages (including photos and search results) within 3 seconds.,"21, 27, 28, 29, 57, 58, 75, 101, 107"
0,NFR005,NON_FUNCTIONAL,The system shall refresh content without unintended full-page reloads.,"4, 42, 107"
0,NFR006,NON_FUNCTIONAL,The system shall not disrupt cellular data connectivity during or after crashes.,54
0,NFR007,NON_FUNCTIONAL,The system shall consume <10% of device memory during active use.,"15, 18, 47, 53"
0,NFR008,NON_FUNCTIONAL,The system shall support Android 4.1+ without device-specific crashes.,"13, 22, 62, 99"
1,FR009,FUNCTIONAL,The system shall allow users to delete comments.,"112, 116, 123, 136"
1,FR010,FUNCTIONAL,The system shall allow users to edit comments.,"116, 140"
1,FR011,FUNCTIONAL,The system shall provide an option to save media to an SD card.,116
1,FR012,FUNCTIONAL,The system shall include an exit button to fully close the app.,"127, 147"
1,FR013,FUNCTIONAL,The system shall allow users to change their cover photo.,"116, 123"
1,FR014,FUNCTIONAL,"The system shall provide a ""most recent"" sorting option for posts.",116
1,FR015,FUNCTIONAL,The system shall enable users to close pictures after opening them.,160
1,FR016,FUNCTIONAL,The system shall ensure notifications clear from the home screen after being addressed.,159
1,FR017,FUNCTIONAL,The system shall allow users to like and comment on posts regardless of scrolling speed.,158
1,NFR009,NON_FUNCTIONAL,"The system shall prevent force closes during normal operation (e.g., scrolling, opening pictures, or writing comments) with a 99% success rate.","108-156, 158-178"
1,NFR010,NON_FUNCTIONAL,The system shall load pictures and comments within 3 seconds under normal network conditions.,"110, 114, 116, 123, 144, 168, 176, 178"
1,NFR011,NON_FUNCTIONAL,The system shall refresh the newsfeed and display updates in chronological order.,"116, 123, 177"
1,NFR012,NON_FUNCTIONAL,The system shall provide consistent push notifications for new messages.,146
1,NFR013,NON_FUNCTIONAL,The system shall upload videos within 60 seconds for files up to 100MB.,140
1,NFR014,NON_FUNCTIONAL,The system shall handle background processes efficiently to minimize battery drain.,"127, 147"
1,NFR015,NON_FUNCTIONAL,The system shall initialize and open within 5 seconds on devices with ≥2GB RAM.,"109, 172"
2,FR018,FUNCTIONAL,The system shall load all comments on posts without requiring additional user interaction.,"180, 202, 206, 220, 234, 239, 250, 253"
2,FR019,FUNCTIONAL,The system shall continuously load new stories as the user scrolls down the news feed.,"182, 190, 200, 204, 207, 212, 244, 251"
2,FR020,FUNCTIONAL,"The system shall display ""Most Recent"" posts as the default news feed view when selected by the user.",205
2,FR021,FUNCTIONAL,The system shall allow users to view and interact with uploaded pictures in their news feed and profiles.,"187, 192, 195, 199, 203, 215, 216, 224, 253, 254"
2,FR022,FUNCTIONAL,"The system shall provide notifications for user interactions (e.g., likes, comments) reliably.","191, 207, 231"
2,FR023,FUNCTIONAL,The system shall enable users to post status updates and pictures without delays or errors.,"201, 219, 230, 258"
2,FR024,FUNCTIONAL,The system shall optimize the display of images and posts for tablet devices.,252
2,NFR016,NON_FUNCTIONAL,The system shall load images in the news feed within 2 seconds under normal network conditions (2Mbps+).,"181, 183, 184, 185, 186, 188, 189, 194, 196, 197, 198, 209, 210, 213, 214, 217, 218, 222, 225, 227, 228, 229, 232, 233, 236, 237, 238, 240, 241, 242, 243, 245, 246, 247, 248, 249, 250, 255, 256, 257"
2,NFR017,NON_FUNCTIONAL,The system shall load comments on posts within 3 seconds under normal network conditions.,"180, 206, 220, 234, 239, 250"
2,NFR018,NON_FUNCTIONAL,The system shall refresh the news feed within 2 seconds upon user request.,"190, 200, 204, 207, 244, 251"
2,NFR019,NON_FUNCTIONAL,The system shall not freeze or crash during image loading or general navigation.,"185, 188, 189, 194, 205, 218, 219, 221, 231, 235, 240, 247, 248"
2,NFR020,NON_FUNCTIONAL,The system shall minimize the display of ads and sponsored posts to no more than 20% of the news feed content.,"208, 230"
2,NFR021,NON_FUNCTIONAL,"The system shall ensure images are displayed in a consistent and visually appealing format (no empty spaces, distorted sizes).","211, 252"
2,NFR022,NON_FUNCTIONAL,"The system shall maintain a success rate of 99% for loading all core features (news feed, images, comments) under stable network conditions.","179, 181, 182, 183, 187, 190, 191, 192, 193, 194, 196, 199, 200, 201, 202, 203, 204, 205, 207, 209, 210, 212, 214, 215, 216, 217, 218, 219, 220, 221, 222, 223, 224, 225, 226, 227, 228, 229, 230, 231, 232, 233, 234, 235, 236, 237, 238, 239, 240, 241, 242, 243, 244, 245, 246, 247, 248, 249, 250, 251, 253, 254, 255, 256, 257, 258"
3,FR025,FUNCTIONAL,The system shall correctly detect and validate network connectivity before displaying error messages.,"259, 260, 261, 262, 263, 264, 266, 267, 268, 269, 270, 271, 272, 273, 274, 276, 277, 279, 280, 281, 282, 283, 284, 285, 286, 287, 288, 289, 290, 291, 292, 293, 295, 296, 297, 298, 299, 300, 301, 302, 303, 304, 306, 309, 310, 311, 312, 313, 314, 315, 316, 317, 318, 319, 320, 321, 322, 323, 324, 325, 326, 327, 328, 329, 330, 331, 332, 333, 334, 335, 336, 338, 339, 341, 342, 343, 344, 345, 346, 347, 348, 349, 351, 352, 353, 354, 355, 356, 357, 358, 359, 360, 361"
3,FR026,FUNCTIONAL,"The system shall provide clear and actionable error messages for network-related issues (e.g., ""Network Error"" should include troubleshooting steps).","259, 260, 261, 262, 263, 264, 266, 267, 268, 269, 270, 271, 272, 273, 274, 276, 277, 279, 280, 281, 282, 283, 284, 285, 286, 287, 288, 289, 290, 291, 292, 293, 295, 296, 297, 298, 299, 300, 301, 302, 303, 304, 306, 309, 310, 311, 312, 313, 314, 315, 316, 317, 318, 319, 320, 321, 322, 323, 324, 325, 326, 327, 328, 329, 330, 331, 332, 333, 334, 335, 336, 338, 339, 341, 342, 343, 344, 345, 346, 347, 348, 349, 351, 352, 353, 354, 355, 356, 357, 358, 359, 360, 361"
3,FR027,FUNCTIONAL,"The system shall maintain functionality for core features (e.g., posting, liking, viewing feeds) even under unstable network conditions.","280, 303, 321, 329, 332, 333, 354, 358"
3,FR028,FUNCTIONAL,The system shall support seamless switching between Wi-Fi and mobile data without requiring app restart.,"272, 299, 305, 318, 330"
3,FR029,FUNCTIONAL,"The system shall provide offline mode capabilities for basic actions (e.g., drafting posts, viewing cached content).","280, 321, 329, 354"
3,NFR023,NON_FUNCTIONAL,The system shall maintain a network connection stability rate of ≥99.5% under stable external network conditions.,"259, 260, 261, 262, 263, 264, 266, 267, 268, 269, 270, 271, 272, 273, 274, 276, 277, 279, 280, 281, 282, 283, 284, 285, 286, 287, 288, 289, 290, 291, 292, 293, 295, 296, 297, 298, 299, 300, 301, 302, 303, 304, 306, 309, 310, 311, 312, 313, 314, 315, 316, 317, 318, 319, 320, 321, 322, 323, 324, 325, 326, 327, 328, 329, 330, 331, 332, 333, 334, 335, 336, 338, 339, 341, 342, 343, 344, 345, 346, 347, 348, 349, 351, 352, 353, 354, 355, 356, 357, 358, 359, 360, 361"
3,NFR024,NON_FUNCTIONAL,The system shall load all feed content within ≤3 seconds under optimal network conditions (4G/LTE or Wi-Fi).,"269, 280, 287, 288, 306, 314, 323, 330, 333, 354"
3,NFR025,NON_FUNCTIONAL,"The system shall minimize false ""Network Error"" prompts (target: ≤1 false error per 100 user sessions).","259, 260, 261, 262, 263, 264, 266, 267, 268, 269, 270, 271, 272, 273, 274, 276, 277, 279, 280, 281, 282, 283, 284, 285, 286, 287, 288, 289, 290, 291, 292, 293, 295, 296, 297, 298, 299, 300, 301, 302, 303, 304, 306, 309, 310, 311, 312, 313, 314, 315, 316, 317, 318, 319, 320, 321, 322, 323, 324, 325, 326, 327, 328, 329, 330, 331, 332, 333, 334, 335, 336, 338, 339, 341, 342, 343, 344, 345, 346, 347, 348, 349, 351, 352, 353, 354, 355, 356, 357, 358, 359, 360, 361"
3,NFR026,NON_FUNCTIONAL,"The system shall function identically across all supported Android devices (e.g., Samsung Galaxy S3, Note 10.1) and OS versions (e.g., Jelly Bean).","259, 296, 348"
3,NFR027,NON_FUNCTIONAL,"The system shall log and categorize network errors for debugging, with a resolution target of 90% within 48 hours of detection.","265, 294, 307, 308, 337, 340, 350"
4,FR030,FUNCTIONAL,"The system shall allow users to view all photos in their news feed, including those marked as ""viewable by friends.""","362, 363, 364, 365, 366, 368, 369, 370, 372, 373, 374, 375, 376, 377, 379, 380, 381, 382, 383, 384, 385, 386, 387, 388, 389, 390, 391, 392, 393, 394, 395, 396, 397, 399, 400, 401, 402, 403, 404, 405, 406, 407, 408, 409, 410, 411, 412, 413, 414, 416, 420, 421, 422, 423, 424, 425, 426, 427, 429, 430, 431, 433, 434, 435, 436, 437, 438, 440, 441, 442, 443, 444, 446, 447, 448, 450, 451"
4,FR031,FUNCTIONAL,"The system shall correctly display the selected photo when a user clicks on it in the news feed, without showing a different photo from the same album.","373, 374, 392, 397, 399, 421, 448"
4,FR032,FUNCTIONAL,The system shall allow users to exclude specific folders from appearing in the photo selection page.,367
4,FR033,FUNCTIONAL,"The system shall support full display of photo captions, including those with more than 2-3 words, without truncation.","417, 445"
4,FR034,FUNCTIONAL,The system shall allow users to choose specific albums when viewing or uploading photos.,445
4,FR035,FUNCTIONAL,The system shall provide a single press of the back button to exit from an enlarged photo view.,"418, 419, 432, 439, 449"
4,NFR028,NON_FUNCTIONAL,The system shall display photos in the news feed with a success rate of 99.9%.,"362, 363, 364, 365, 366, 368, 369, 370, 372, 375, 376, 377, 379, 380, 381, 382, 383, 384, 385, 386, 387, 388, 389, 390, 391, 392, 393, 394, 395, 396, 397, 399, 400, 401, 402, 403, 404, 405, 406, 407, 408, 409, 410, 411, 412, 413, 414, 416, 420, 421, 422, 423, 424, 425, 426, 427, 429, 430, 431, 433, 434, 435, 436, 437, 438, 440, 441, 442, 443, 444, 446, 447, 448, 450, 451"
4,NFR029,NON_FUNCTIONAL,The system shall load and display photos in the news feed within 2 seconds.,"371, 375, 423, 425, 426"
4,NFR030,NON_FUNCTIONAL,The system shall maintain zoom level when rotating the device from portrait to landscape mode while viewing a photo.,398
4,NFR031,NON_FUNCTIONAL,"The system shall provide a clear error message when a photo cannot be retrieved, instead of displaying a blank or grey image.","382, 383, 389, 440"
5,FR036,FUNCTIONAL,The system shall provide an option to adjust font size within the app.,466
5,FR037,FUNCTIONAL,The system shall allow users to opt out of contact syncing permanently.,"497, 537, 541, 544, 547"
5,FR038,FUNCTIONAL,"The system shall provide a toggle to disable ""Find Friends"" prompts permanently.","467, 479, 488, 519, 535, 536, 539, 541, 544, 547"
5,FR039,FUNCTIONAL,"The system shall restore the ""Friends"" button and its functionality.",469
5,FR040,FUNCTIONAL,The system shall enable saving media to SD card.,477
5,FR041,FUNCTIONAL,The system shall allow users to filter friends/pages alphabetically by category.,527
5,FR042,FUNCTIONAL,The system shall provide an option to watch YouTube videos through the YouTube app when linked from Facebook.,518
5,FR043,FUNCTIONAL,The system shall ensure contact sync functionality is available and visible in settings.,"455, 461, 468, 515"
5,FR044,FUNCTIONAL,"The system shall prevent unauthorized access via the ""Sign Up for Facebook"" button.",483
5,FR045,FUNCTIONAL,The system shall ensure games and third-party apps can link with Facebook.,"524, 525"
5,NFR032,NON_FUNCTIONAL,"The system shall load all user-specific pages (profile, messages, events) in under 3 seconds.","463, 473, 490, 494, 509, 511, 534, 549"
5,NFR033,NON_FUNCTIONAL,The system shall maintain a crash rate of <0.1% during normal usage.,"453, 456, 465, 487, 495, 496, 500, 543"
5,NFR034,NON_FUNCTIONAL,"The system shall provide feature parity with the web version for core functions (e.g., posting, messaging, events).","473, 516"
5,NFR035,NON_FUNCTIONAL,The system shall handle image/video uploads with a success rate of 99% and complete within 10 seconds on stable connections.,"487, 548"
5,NFR036,NON_FUNCTIONAL,The system shall maintain network connectivity with <1% failure rate on stable connections.,"460, 507, 522, 530, 533"
5,NFR037,NON_FUNCTIONAL,"The system shall minimize intrusive prompts (e.g., ""Find Friends"") to once per installation unless manually reactivated.","467, 479, 488, 519, 535, 536, 539, 541, 544, 547"
5,NFR038,NON_FUNCTIONAL,The system shall sync contact photos in high quality within 1 minute of changes.,"455, 465, 468"
5,NFR039,NON_FUNCTIONAL,The system shall fully terminate all processes upon logout to prevent residual memory usage.,523
5,NFR040,NON_FUNCTIONAL,The system shall ensure notifications function correctly with a delivery success rate of 99%.,506
5,NFR041,NON_FUNCTIONAL,"The system shall provide clear error messages for failed actions (e.g., uploads, sync) with actionable steps.","508, 534"
6,FR046,FUNCTIONAL,The system shall ensure successful login attempts with a 99.9% success rate.,"550, 552, 553, 558, 561, 568, 570, 571, 578"
6,FR047,FUNCTIONAL,"The system shall synchronize user actions (e.g., posts, likes) across mobile and web platforms in real-time.","551, 567, 573"
6,FR048,FUNCTIONAL,"The system shall provide access to all core features (e.g., Pages, Events) without errors.","554, 560, 576"
6,FR049,FUNCTIONAL,The system shall open links within the app instead of redirecting to a browser.,555
6,FR050,FUNCTIONAL,The system shall support offline comment drafting with automatic posting upon reconnection.,572
6,FR051,FUNCTIONAL,"The system shall prevent involuntary logout during active sessions (e.g., while typing).",577
6,NFR042,NON_FUNCTIONAL,The system shall maintain session stability with no unplanned logouts for 99.5% of users over a 24-hour period.,"565, 569, 577"
6,NFR043,NON_FUNCTIONAL,"The system shall refresh content (e.g., Statuses, Events) within 2 seconds of user request.","559, 560, 569"
6,NFR044,NON_FUNCTIONAL,The system shall display all pages and features without blank screens or missing options.,"556, 576"
6,NFR045,NON_FUNCTIONAL,The system shall handle check-ins without freezing or errors for 99% of attempts.,"562, 566"
6,NFR046,NON_FUNCTIONAL,"The system shall install/update successfully for 99.9% of users without ""invalid package"" or ""error 503"" messages.","557, 564, 574"
6,NFR047,NON_FUNCTIONAL,"The system shall maintain stable network connectivity, with no more than 0.1% disconnection rate during active use.","569, 573"
7,FR052,FUNCTIONAL,"The system shall persist ""Like"" actions on statuses, photos, and comments without automatic unliking upon refresh or navigation.","579, 589, 590, 592, 604, 622, 628, 640, 641, 642, 660"
7,FR053,FUNCTIONAL,"The system shall allow users to view ""Most Recent"" posts as the default and persistent setting when selected.","580, 586, 588, 599, 610, 615, 619, 626, 631, 652, 658, 664, 666"
7,FR054,FUNCTIONAL,The system shall enable users to navigate to a person's profile directly from their photo or comment.,"581, 593, 623"
7,FR055,FUNCTIONAL,"The system shall ensure the ""Like"" button for photos and statuses is distinct from the ""View Likes/Comments"" button to prevent accidental taps.","606, 617"
7,FR056,FUNCTIONAL,The system shall allow users to upload photos without mandatory location information.,591
7,FR057,FUNCTIONAL,The system shall provide a visible and accessible comment field even when the keyboard is open.,"597, 598"
7,FR058,FUNCTIONAL,The system shall enable users to reply to comments directly from the comment thread.,"611, 621, 665"
7,FR059,FUNCTIONAL,The system shall allow users to upload photos directly to a specific person's wall.,625
7,FR060,FUNCTIONAL,"The system shall display accurate like counts (e.g., beyond 98) for photos and statuses.","633, 648"
7,FR061,FUNCTIONAL,The system shall ensure notifications for comments and likes are delivered consistently.,"585, 620, 629, 649"
7,NFR048,NON_FUNCTIONAL,The system shall prevent unintended scrolling or refreshing while users are typing comments or viewing posts.,"582, 632, 636, 639, 644"
7,NFR049,NON_FUNCTIONAL,"The system shall load and display new posts in the ""Most Recent"" feed within 2 seconds of user request.","584, 588, 599, 610, 631, 652, 658, 664"
7,NFR050,NON_FUNCTIONAL,"The system shall successfully process and persist status updates, comments, and likes with a 99% success rate.","587, 594, 600, 601, 605, 607, 608, 609, 612, 616, 621, 624, 634, 637, 645, 646, 647, 650, 654, 656, 662"
7,NFR051,NON_FUNCTIONAL,"The system shall ensure the ""Like"" button registers user taps within 1 attempt in 95% of cases.","618, 641, 642"
7,NFR052,NON_FUNCTIONAL,The system shall refresh the newsfeed without resetting the user's scroll position unexpectedly.,"596, 632, 636, 657"
7,NFR053,NON_FUNCTIONAL,The system shall provide real-time updates for likes and comments on posts with less than 5 seconds of delay.,"603, 629, 659"
8,FR062,FUNCTIONAL,The system shall include an integrated chat feature.,671
8,FR063,FUNCTIONAL,The system shall provide a functional widget for reduced-size operation.,"672, 708"
8,FR064,FUNCTIONAL,The system shall allow users to disable background syncing to conserve battery.,"702, 739"
8,FR065,FUNCTIONAL,The system shall support HD tablet-optimized layouts.,667
8,FR066,FUNCTIONAL,The system shall minimize bloatware and focus on core functionality.,755
8,NFR054,NON_FUNCTIONAL,"The system shall load all user-specific pages (e.g., profile, settings) in under 2 seconds.","670, 673, 674, 675, 676, 677, 678, 679, 680, 681, 684, 685, 686, 689, 690, 691, 692, 693, 694, 695, 696, 697, 699, 701, 703, 704, 705, 706, 707, 709, 710, 711, 712, 713, 714, 715, 716, 717, 719, 720, 721, 722, 723, 725, 727, 728, 729, 730, 731, 732, 733, 734, 735, 736, 737, 740, 741, 742, 743, 745, 748, 749, 750, 751, 752, 756, 757"
8,NFR055,NON_FUNCTIONAL,The system shall consume ≤20% of CPU and ≤300MB RAM during typical usage.,"668, 694, 701, 707, 739, 745, 746, 753"
8,NFR056,NON_FUNCTIONAL,The system shall achieve a crash rate of <0.1% per user session.,"669, 683, 706, 711, 715, 718, 724, 732, 733, 745, 752"
8,NFR057,NON_FUNCTIONAL,The system shall limit background battery drain to ≤1% per hour when idle.,"668, 702, 707, 739, 746, 753"
8,NFR058,NON_FUNCTIONAL,"The system shall ensure interface responsiveness (e.g., taps, scrolls) with <100ms latency.","672, 688, 699, 708, 722, 724, 728"
8,NFR059,NON_FUNCTIONAL,The system shall function reliably on mobile networks with latency ≤500ms.,"684, 700, 747"
8,NFR060,NON_FUNCTIONAL,The system shall clear cached data automatically to prevent excessive storage growth.,746
9,FR067,FUNCTIONAL,The system shall correctly load and display images when selected by the user.,"758, 759, 760, 761, 762, 763, 764, 766, 767, 768, 769, 770, 771, 772, 773, 774, 775, 776, 777, 778, 779, 780, 781, 782, 783, 784, 785, 786, 787, 788, 789, 790, 791, 792, 793, 794, 795, 796, 797, 798, 799, 800, 801, 802, 803, 804, 805, 806, 807, 808, 810, 811, 812, 813, 814, 815, 816, 817, 818, 819, 820, 821, 822, 823, 824, 825, 826, 827, 828, 829, 830, 831, 832, 833, 834, 835, 836, 837, 838, 839, 841, 842, 843, 844, 845, 846"
9,FR068,FUNCTIONAL,The system shall ensure that the correct image is displayed when opened (no mismatched images).,"768, 770, 788, 828"
9,FR069,FUNCTIONAL,The system shall allow users to download images from the app.,"772, 809, 821, 830, 832, 846"
9,FR070,FUNCTIONAL,The system shall prevent forced redirections to Instagram when interacting with images.,840
9,FR071,FUNCTIONAL,The system shall handle image loading independently of network type (3G/H/Wi-Fi) without errors.,"799, 802, 816"
9,NFR061,NON_FUNCTIONAL,The system shall load images in under 3 seconds under normal network conditions.,"760, 771, 775, 789, 799, 816, 818, 819, 822, 834"
9,NFR062,NON_FUNCTIONAL,The system shall successfully load images with a failure rate of <1% (excluding network-related issues).,"761, 762, 767, 774, 777, 780, 782, 783, 784, 790, 791, 792, 793, 795, 796, 797, 803, 807, 812, 813, 815, 817, 820, 824, 825, 828, 830, 831, 835, 836, 839, 843, 845"
9,NFR063,NON_FUNCTIONAL,"The system shall display meaningful error messages when images fail to load (e.g., ""Cannot retrieve image, please check your connection"").","761, 774, 777, 797, 803, 805, 816, 820, 845"
9,NFR064,NON_FUNCTIONAL,The system shall maintain responsiveness (no freezing/crashing) when loading or interacting with images.,"769, 775, 789, 812, 813, 816, 822, 828"
9,NFR065,NON_FUNCTIONAL,The system shall minimize intrusive ads to prevent interference with image loading and user experience.,"761, 765, 831"
10,FR072,FUNCTIONAL,The system shall allow users to manually disable automatic updates.,"864, 873, 884, 907"
10,FR073,FUNCTIONAL,The system shall provide an option to revert to the previous stable version of the app.,"852, 864, 901"
10,FR074,FUNCTIONAL,The system shall ensure the search bar functions correctly and returns results without delays.,"888, 896, 903"
10,FR075,FUNCTIONAL,The system shall allow users to edit previous posts.,874
10,FR076,FUNCTIONAL,The system shall sync properly with Google services.,860
10,FR077,FUNCTIONAL,The system shall resolve single sign-on (SSO) errors and provide clear troubleshooting steps.,870
10,NFR066,NON_FUNCTIONAL,The system shall ensure the app refreshes content successfully with a 99% success rate.,"849, 854, 856, 867, 905, 909, 912"
10,NFR067,NON_FUNCTIONAL,"The system shall load all user-specific pages (e.g., feed, profile, settings) in under 2 seconds.","851, 881, 882"
10,NFR068,NON_FUNCTIONAL,"The system shall provide clear error messages for installation failures (e.g., storage, signing issues).","857, 866, 869, 871, 878, 890"
10,NFR069,NON_FUNCTIONAL,The system shall maintain login functionality after password changes without requiring reinstallation.,"875, 877, 883"
10,NFR070,NON_FUNCTIONAL,The system shall minimize data usage during updates and background refreshes.,913
10,NFR071,NON_FUNCTIONAL,"The system shall ensure app stability post-update, with no more than 1 crash per 1000 sessions.","850, 852, 855, 862, 865, 867, 872, 887, 898, 899, 906, 911"
10,NFR072,NON_FUNCTIONAL,"The system shall allow updates to be downloaded and installed via device-specific stores (e.g., Samsung Galaxy Store).",893
11,FR078,FUNCTIONAL,"The system shall ensure all basic features (e.g., loading pages, updating content, displaying notifications) function reliably without crashes or freezes.","915, 917, 920, 921, 924, 929, 930, 932, 933, 934, 937, 941, 951, 952, 956, 958, 962, 964, 966, 967, 971, 974, 975, 976, 977, 979, 980"
11,FR079,FUNCTIONAL,The system shall implement pre-release testing for updates to minimize post-update bugs and performance degradation.,"927, 938, 960, 973, 975"
11,FR080,FUNCTIONAL,The system shall optimize compatibility with low-range Android devices to ensure stable performance.,"963, 964, 978"
11,FR081,FUNCTIONAL,The system shall improve UI responsiveness for larger screens.,955
11,NFR073,NON_FUNCTIONAL,"The system shall load all user-specific pages (feed, notifications, settings) in under **2 seconds** under normal network conditions (4G/LTE).","915, 918, 922, 926, 931, 939, 940, 942, 943, 944, 946, 947, 948, 949, 957, 959, 960, 969, 972, 973, 975"
11,NFR074,NON_FUNCTIONAL,"The system shall maintain a **99% uptime** for core functionalities (loading posts, updates, notifications) with no forced closures.","924, 928, 933, 934, 940, 952, 962, 971, 976, 980"
11,NFR075,NON_FUNCTIONAL,The system shall reduce SSL handshake errors during data retrieval to **<0.1% occurrence rate**.,942
11,NFR076,NON_FUNCTIONAL,The system shall prioritize bug fixes for existing features over introducing new features until core stability is achieved.,"937, 941, 956, 965, 966"
11,NFR077,NON_FUNCTIONAL,"The system shall support Android 4.2+ and non-standard ROMs (e.g., Rootbox) without installation failures.",978
11,NFR078,NON_FUNCTIONAL,"The system shall ensure update processes (e.g., syncing notifications, refreshing feeds) complete within **5 seconds** on 4G networks.","918, 926, 939, 943, 944, 947, 949, 969, 972"
