,requirement_id,type,description,based_on_comments
179,NFR067,NON_FUNCTIONAL,The system shall incorporate user feedback from the rating section into biweekly bug-fix sprints.,"920, 941, 966"
180,NFR068,NON_FUNCTIONAL,"The system shall reduce post-update performance degradation (e.g., slow loading, crashes) to **<5% user-reported incidents per release**.","938, 960, 973, 975, 979"
181,NFR069,NON_FUNCTIONAL,The system shall provide clear error messages when network conditions are adequate but the app fails to load content.,"953, 962, 974"
182,NFR070,NON_FUNCTIONAL,The system shall load notifications and messages within 30 seconds of receipt.,"982, 985, 1000, 1011, 1018, 1021, 1047"
183,NFR071,NON_FUNCTIONAL,The system shall maintain notification and message synchronization with the server with no more than 1-minute delay.,"983, 986, 1005, 1008, 1009, 1010, 1014, 1018, 1026, 1028, 1030, 1037, 1041, 1045, 1050, 1052, 1055"
184,NFR072,NON_FUNCTIONAL,"The system shall prevent freezing or endless loading states for feeds, notifications, and messages.","988, 992, 994, 995, 1006, 1016, 1020, 1023, 1033, 1035, 1048, 1056"
185,NFR073,NON_FUNCTIONAL,The system shall minimize memory usage to under 20MB for background processes.,"1029, 1040, 1054"
186,NFR074,NON_FUNCTIONAL,The system shall retain user notification settings without resetting.,1044
187,NFR075,NON_FUNCTIONAL,The system shall ensure consistent feed update order based on user preferences.,"1013, 1032"
188,NFR076,NON_FUNCTIONAL,The system shall successfully upload photos with a 99% success rate under normal network conditions.,"1059, 1065, 1071, 1077, 1080, 1081, 1089, 1091, 1094, 1100, 1105, 1113, 1119, 1125, 1131, 1135, 1149, 1167"
189,NFR077,NON_FUNCTIONAL,"The system shall load photo thumbnails within 3 seconds, even for devices with large photo libraries.","1106, 1107"
190,NFR078,NON_FUNCTIONAL,"The system shall ensure that photo upload failures provide actionable error messages (e.g., ""Upload failed: Retry?"").","1081, 1094, 1105, 1135"
191,NFR079,NON_FUNCTIONAL,The system shall support photo and video uploads across all major Android device models and OS versions.,"1058, 1060, 1074, 1096, 1128"
192,NFR080,NON_FUNCTIONAL,The system shall allow users to exit full-screen photo view with a single back-button press.,"1062, 1103"
193,NFR081,NON_FUNCTIONAL,The system shall prevent app freezes during photo uploads or gallery browsing.,"1083, 1104, 1107"
194,NFR082,NON_FUNCTIONAL,The system shall ensure that new photos and comments appear in the timeline without delays or omissions.,"1089, 1142, 1143, 1151"
195,NFR083,NON_FUNCTIONAL,The system shall provide a consistent and intuitive interface for sharing media (photos/videos) to external apps.,"1144, 1145, 1146, 1148"
196,NFR084,NON_FUNCTIONAL,"The system shall load all user-requested content (e.g., feed, messages, images) within 3 seconds on WiFi or 4G/LTE connections.","1168, 1171, 1174, 1175, 1184, 1188, 1199, 1200, 1203, 1208, 1211, 1212, 1213, 1231, 1232, 1234, 1238, 1240, 1248, 1254, 1256, 1259"
197,NFR085,NON_FUNCTIONAL,"The system shall maintain basic functionality (e.g., text loading) on 2G connections with a maximum latency of 5 seconds per action.","1183, 1243, 1249, 1250"
198,NFR086,NON_FUNCTIONAL,The system shall achieve a 99% success rate for content loading under stable network conditions (WiFi/4G).,"1170, 1172, 1178, 1180, 1189, 1190, 1191, 1195, 1197, 1204, 1209, 1215, 1216, 1219, 1228, 1235, 1239, 1244, 1247, 1261, 1262, 1265"
199,NFR087,NON_FUNCTIONAL,"The system shall resolve WiFi-specific loading issues (e.g., authentication/timeout errors) for all major router configurations.","1181, 1202, 1205, 1220, 1246, 1264"
200,NFR088,NON_FUNCTIONAL,The system shall reduce battery and data consumption during background updates by 30%.,1241
